SentimentText,Sentiment
"As General Marsh took to the stage, he immediately captivated the attention of the audience - almost as if he was personally leading a cavalry charge into the heart of the enemy.",0.0
Then he turned away and caught up to Estrilla.,0.0
"Kyle punched the throttle of his shuttle, weapons systems booting their soft AIs.",0.0
"The Hamaroosan shushed him, assisting the two others in stripping the armor from him.",0.0
"Lately, I’ve been in a really dark place with myself.",1.0
"""I can't even remember why!",0.0
"I guess some people would just call it ""depression"", but I've never been so distinctly happy at the same time.",1.0
"Not that I couldn't, just like most humans I had received my genetic enhancement therapy back when I was a toddler, so I could easily digest all but the most extreme foods in the known ecosystems.",0.0
I have the feeling of wanting to die but I don’t want to comment suicide.,1.0
I pretty much have to place the food on my tongue and swallow.,0.0
"i'm 24 year old and i feel like my mind has shrunk probably because i didn't use it well i find it difficult to concentrate and it feels impossible to learn anything in life,and i get panicked when i don't understand something.hoping to get my GED thinking it's going to help me to feel better.",1.0
"The last time I talked to her, she called me insane and said if I ever contacted her or her family again she would file a restraining order.",0.0
"The *Columbia-II* was joined by dozens of ships identical to it, each one assigned to patrol and defend a different part Human space.",0.0
but i really regret putting this on them.,1.0
"Having days, weeks or months with limited company ✅✅✅✅✅✅

10.",0.0
"I've hurt, I've manipulated for my own selfish gain, and I've changed as a person entirely.",0.0
This is data.,0.0
Further remains found in the river were later identified as Shelley Armitage’s.,0.0
I just want to be normal again.,1.0
all i do is sit in my room.,1.0
"Everyone flocked to him and congratulated him for being strong, but when I brought up that I was still struggling and said that I was horrified of being alienated by my family, they called me lazy, saying I ""wasn't taking initiative"" to talk to someone.",1.0
"But I will stop beating around the bush.""",0.0
I want to die.,1.0
I went through depression once and came back our motivated.,0.0
Here’s the story of my years-long battle.,0.0
"Then I picked 4 onions and when meat had roasted about 1/4 hr., I poured about a pint of water over it for gravy and put in the onions.",0.0
I just hope I did the right thing.,1.0
Just stop living.,1.0
"""Friend Terry did,"" Mother answered.",0.0
His fingers closed around it and Insight flowed through his mind.,0.0
I hate myself and most days I hate my life.,1.0
I'm tired of being the superhero I am.,0.0
"The Brotherhood doesn’t make compromises, they don’t give up, and they’re too smart to flat-out implicate themselves in the eyes of their enemies.",0.0
I have felt like this for years now.,1.0
"this gets me so lonely, because i find that i am only truly myself around them.",1.0
I'm here typing away while I listen to music and crying like a baby.,1.0
"Even for the Migrants, the stars were distant, the travels were long, and the farthest galaxies were perhaps unreachable.",0.0
"If I had to compare the experience, it was something of a mix between falling into the black hole in Interstellar, and Warp travel from Astartes.",0.0
"**First Theory:**

As mentioned before, the most widely agreed upon theory is that Alex Vega was on the run, avoiding the warrant put out for his arrest.",0.0
"I've read the ancient scriptures, I knew it had attacked one of your worlds - you of all creatures should know the threat of the Great Darkness!""",0.0
"/u/Baconated-Grapefruit**|
 &nbsp; | 2.",0.0
I just feel like absolute trash sometimes.,1.0
"Four Years Ago:

I'm waking up in a waterbed, the man sleeping next to me I can't recall from my blurry head if his name is Kenny or Chris, but he gave me drugs and I didn't have money to pay so the transaction had to be a disgraceful one.",0.0
"How could such devastation be possible?""",0.0
"""Do you think the Innkeeper will take a message to deliver to Major when he arrives?",0.0
"They tossed the portable cannon aside, and the heavy thing slammed into the ground, before taking a grip once again on the sword, that looked almost hewn from stone if not for the shine, and slammed it downwards.",0.0
Because of this most of those friends had no clue she had that black lantern job.,0.0
Water is 3 to 4 ft.,0.0
I thought my first homosexual experience would be on a college campus.,0.0
"The question was however, could they afford the price that they were paying?",0.0
"Immediately, he notices Camael's sullen expression, as well as her ashen skin.",0.0
I'd like to share something with everyone that has made a world of difference for me.,0.0
So now this hunter named Shank appeared to know that Grimore knew something.,0.0
I feel like I'm failing myself as I failed them.,1.0
"Cosimo, on the other side of the coin that displays his face, spends twenty years barking insults at her.",0.0
"Orias bellows at the girl, cowing her into submission.",0.0
I Desperately need some legal guidance and I'm hoping someone can help.,0.0
Not eating.,0.0
I hate being this way towards them.,0.0
"Edit
Thank you everyone for your comments.",0.0
"""Yes, it is where we were uplifted.",0.0
She told him she was Princess Anastasia from Russia and asked him not  to tell anyone about that.,0.0
"Recently the Durma have changed the avatar of their god of vengeance to that of a human.""",0.0
"I also did sign up for dating sites to meet new people but am always quiet on dates, so the guys will eventually just unmatched me or stop replying to me if we did exchange texting platforms.",1.0
Jepthath bites his lip.,0.0
"So you're left wondering, if I just fell off the face of the earth, how long would it take for people to actually notice?",1.0
Have you slept with him before?,0.0
fuck me.. Fuck this capatilistic society and all the ‘be a fucking doctor’ and ‘youre a fucking retard’ that come with.,1.0
“Sounds weird.,0.0
I should be able to pull the plug if my suffering is too much to bare.,1.0
"“Good.” he said, “Let us be leaving at speed.”

&nbsp;

“Now, the matter of finding the right ship.”

It was high noon.",0.0
Not that I expect anything because I enjoy doing things for my spouse.,0.0
"I wasn't that sure about my own body, though.",0.0
"someone please, just run me over already.",1.0
My mom and I fight alot over very stupid things and I don't know why.,0.0
It’s like I’m constantly holding it together until my next breakdown which only adds to the fact I feel like a mess.,1.0
"And for some reason, I feel like I'm faking depression.",1.0
"She left again with a flashlight and was found dead early next morning (Jan 29th, a day after Collins was found), face down on the highway line about 1/5th of a mile away from the car.",0.0
I'm back to smoking and feel it is all down hill from here.,1.0
I went to the hospital and set up an appointment to talk to a therapist.,1.0
I am genuinely considering moving into an isolated cabin somewhere and just living off the land because every day I live in this world is torture.,1.0
"Still kinda in shock from mom, it's softened since it all hit at once.",0.0
If I’m lucky I will be involved in a car crash.,1.0
"**The Unsolved Murder of Jill-Lyn Euto**

Jill-Lyn Euto, 18, was murdered on January 28, 2001.",0.0
"We observe the exterior of the house, after discovering that Mrs. Mac and Clair's bodies are left undiscovered in the attic, only to hear the phone ring again.",0.0
I mean once you realise it you kind of feel like there’s no point in life.,1.0
"May 16th, my dad passes in prison.",0.0
I believe that life is meaningless and anything anyone has done or ever will do is absolutely pointless for one day it will all end.,1.0
I have finals this week and I'll probably fail and idk if I care.,1.0
"- Sitting on your couch and staring at the wall on a Saturday night, because you can't think of anything better to do.",1.0
But I got tongue tied and awkward and kept hesitating and biding my time that I got eliminated in the 2nd round itself....,0.0
**\[Camera\]\[Action Music Commences\]** Fades in above beams of light in the distance.,0.0
The police came around 5 minutes during the call.,0.0
Will the kids eventually figure out my bluff.,0.0
The smell of the foamy cream.,0.0
"He buys beer for he and his friend, he goes to a strip club, and he excuses himself from school.",0.0
It took away my fear of letting others in.,0.0
"“Here you are.” Jason said, trying to not repeat the same mistake he had made of staring.",0.0
It *means* that for the longest time I was fuckin' terrified of changin' what you said was 'established history' an' I tried to live under a rock like you did.,0.0
This made me go even deeper into my depression.,1.0
Sat on the ground sulking that the wind was against me.,1.0
But besides that I loved it there so much less to worry about in the day to day just do your job leave the rest up to fate.,1.0
"and again , im just    *there.",0.0
"Shoot I passed an exam and got a new certification for work and my first thought was ""what's next"".",0.0
I want to be happy.,0.0
I sigh.,0.0
The noise fades and the day advances.,0.0
Did you plug it in?,0.0
"The man was mid-30s, 5 ft 7 in–5 ft 9 in (1.75–1.80 m), slim-to-normal build, with short brown hair, wearing cream or beige trousers.",0.0
The tears were not going to stop until I let everyone else know how sorry I was.,1.0
Bed.,0.0
parties.,0.0
"I really miss her but I know, and see that my ***M*** doesn't exit anymore.",1.0
I dont know.,0.0
"its been a long time since ive written down my thoughts,

i’d say I missed it, but lets connect the dots

im sitting and im watching the people that are gawking

they look back at me, and I to them,

they see what they see, and its them who condemn

the thoughts that I speak, or the thoughts that I think

and if I told you, or told a shrink, id be crazy

so don’t even think, Im ready to fight and ive got the guts,

because ive grown, i grew big nuts

ill stand on the highest tower, and look down to the street

and ill see all those who judge, and all who stare at their feet

if you loved, or if you hated, it doesn’t matter

all our lives are slated, roll the camera, say the lines

stick to the script, and see the signs,

your life is ending and thought defines,

there is a woman, who stands and shines,

 the one for you, and your lifes designes.",0.0
"But she didn't shake my hand like I was expecting her to, as a normal person would.",0.0
I try to be optimistic about my future.,0.0
"For example, about a month ago I was put on medication and it was helping a lot, I was able to do stuff.",0.0
"Like 20 min after that I got there and proceeded to calm my self so I could walk to the edge of the dam, I chose the better spot and started staring at the void for like 3 hours, time and cars passed by while the idea sunk in my head 3 hours passed and I decided to ask a guy who was fishing if he could call 911, he told me he was a cop himself and to sit in the sidewalk while he called someone to get me as I had locked my car with my keys and phone inside.",1.0
"She set her lunchbox, still untouched, on the counter and went out to her balcony to tend to her beloved plants.",0.0
It really hurts.,1.0
I have nothing to look forward to.,1.0
I'm so fucking tired.,1.0
Sol stepped from one foot to the other awkwardly before clearing his throat.,0.0
"Bioweapons got accidentally and/or purposefully released, and we fought an entire war where chemical weapons killing millions in the trenches of the battlefield,"" Friend Terry said, shrugging to signal his horrific indifference to such atrocities.",0.0
Major nodded.,0.0
Who wanted him dead and why?,0.0
My support network is in shambles.,0.0
Just another dope for me to smack around!,0.0
"I just don’t feel like living anymore, nothing seems worth staying here for.",1.0
"While practicing with his ability to meld with the shadows, as any good rogue should, he quickly discovered that he could take on the appearance of a human.",0.0
I'm 16 and already done with life.,1.0
She was also right that it had to be her because she was the only one in here that could be objective.,0.0
When I went in for my doctor's appointment I took that GAD (general anxiety disorder) she later came back and basically said I have severe anxiety with a mild depressive episode.,1.0
"A well-trained human could best many goblins, but unlike the vaulted elves they could come back from lose much quicker.",0.0
I had so much control when I didn’t know what I was thinking.,0.0
"If God is listening, I'll take that position now.",1.0
"""It seems your Archangel title is not merely for show.""",0.0
"Always staying positive, working hard, helping out around the house on top of it all.",0.0
"&#x200B;

I want to cuddle my nieces and be a person who lives by his heart but I am seemingly incapable of breaking self-image.",0.0
Nemta watched him poke at the hologram.,0.0
"I realize it's hard to fight to reclaim your life against a disease controlling your mind and saying you'd be better off dead, but this is why those who battle depression are the strongest people you'll ever meet.",0.0
I think I could do it.,0.0
"I’m 17 I’ve been so depressed for a year or two, I’m not very good at making friends so I don’t really have anyone to talk to.",1.0
"**YOUR EYES WILL STUD MY CROWN...**

Subroutines which had never been run within the Precursor now found themselves called again and again, and for the first time in all the millions of years of its existence, it knew fear.",0.0
I’m lonely as hell and I’m always thinking about it.,1.0
If my own family don’t like me why would anyone else?,0.0
"mostly because of her LYING to me about being pregnant before then having a serious argument when I would use a condom since ""she's already pregnant"" petty I know but i thought (Well, she just wants to have a baby, so she must be happy.",0.0
I feel like I'm losing my mind and have no idea what anything truly is.,1.0
I know it looks bleak for many and that's what drove you to search out this sub-reddit.,0.0
Blackmail me.,0.0
"So as you can tell my life is pretty crap; and personally I find it pretty shitty and patronising tries to say that ""it gets better"" because the reason why I'm suicidal and depressed is for reasons I cannot control, I will probably never forget my past and I don't think that it's a good thing, so I will never technically ""get better"", I'm just gonna have to get used to it because nothing will ever change...",1.0
Mostly cause of me as I give up trying at times.,1.0
I want to be numb again.,1.0
she had confessed for this and ask for apology and we tried to work on that.,0.0
I just know that it wouldn't affect much if i was gone.,0.0
I dont even get angry anymore.,0.0
"I feel happy seeing others smile, and appreciated.",0.0
Man...I fucked up bad.,1.0
So she doesn't come home that night.,0.0
"Maybe if you’re a good girl one day you’ll be able to join Humanity in trying to figure out how it works!”

If Mallas had a jaw, it would be on the floor.",0.0
I'm awkward as all hell.,0.0
"The Cienalorian had a roughly humanoid build, with dull green scales for skin and a lizardesque head.",0.0
Cunning.,0.0
Depression creates a lying world that seems so true and real.,1.0
Sol's Mother spoke- who Asgar realized he did not know the name of nor had he introduced himself to her.,0.0
“You are...wise to be fearful.,0.0
So why the fuck I can't get any love out here?,1.0
Ps I apologize for the poor grammar i’m usually more thorough when I edit my posts but I’ve been at this for such a long time and I feel like Posting sooner than later...,0.0
"It was not only a crime, but somehow even more of a heresy than the Cienalorian's own sin of murdering a human prosecutor.",0.0
"I know it's bad, and it's getting worse, but the last thing I want to do is talk about it and have others feel sorry for me (Family, friends etc).",1.0
"Besides, I am not sure I can do it anyway.",1.0
"I have low self-esteem issues and, even though I’m not the ugliest on earth since I get stared at or hit on every once in a while, I still feel like every guy wants to fool me or harm me somehow every time they approach me.",1.0
"That indicates that no one wants to be my friend and if they do, they'd be betrayers.",1.0
Went to work today.,0.0
"I don’t request a miracle, and I hate to complain about this when I’d rather keep this to myself, but this is too much for me right now.",1.0
i’ll try to make this quick.,0.0
"They love football, I’m lazy and inactive.",0.0
"As useless as feel right now, you still have the opportunity to control even the tiniest bit of your life.",0.0
"I was 15 years old at the time and, Yeah, I’m a guy, but I also have good taste.",0.0
"Asgar nodded, he too, felt like he'd been misusing the saying.",0.0
He’d heard that the dreadnaught Texas had slipped her moorings and sailed off under her own power and volition.,0.0
She did.,0.0
"Which, I now know, was a terrible idea.",0.0
"I can’t even talk to my friends about my problems, they will never understand me.",1.0
"And people stop contacting me when I don’t go to their birthdays, etc.",1.0
Is that an art in itself?,0.0
I'm alone all day.,0.0
"It made me feel an oddly personal connection, seeing her possessions.",0.0
Im tired of it and i want to be happy again but i dont know how anymore.,1.0
Im so tired of this life.,1.0
"::

*Comet's Edge* rolled and vented a burst of heat dismissively.",0.0
And it really scares me how close I came and how close I still am.,1.0
"I don't blame them, because I don't know how to open up and share my problems or even tell them what I've been through.",0.0
I guess I’ll just start off with a preface.,0.0
The thought of a shower doing my hair is so overwhelming.,0.0
The camerawork and colour gradient were a spectacle as well and I just think this movie was an all around well made film.,0.0
"&#x200B;

To be Continued.",0.0
"I have had these problems since I was a kid, but only got diagnosed a year ago as my mum doesn't believe in depression and would never take me to a doctor, and I was afraid to go by myself.",0.0
"And if there is, I don't know if I want to be apart of it..",0.0
“And so we built the great fleet...Task Force *Odin*.,0.0
I stayed there for a week during my treatment and was released today.,0.0
I don't know what else to say.,0.0
"He refuses help, especially now that he would have to ask his mom (whom he lives with) to pay for it.",1.0
"That said, it made me.. not me anymore.",0.0
"Now, do not get me wrong with what I am about to say because you have been a great listener.",0.0
He forgot about most of the stuff we did together.,0.0
"""Hermes is sometimes difficult to understand.",0.0
It started slowly.,0.0
"Simon passed a few years ago and its awesome h9w he still finds time to visit

Just walking may not seem all that much to you but to me its him just being there.",0.0
Where are you?,0.0
Scared to no longer exist.,1.0
"*   
>  
>Product by: \[~~untranslatable~~\] Peculiar Trading Partnership Incorporated (PTP)

\---

The Overseer frowned before he folded the paper and stuffed it into his pocket, his gaze wandering around the damp room - there was another cloth covering a couch.",0.0
Eless had remained reserved as she watched the conversation.,0.0
"As opposed to drinking, I liked to smoke alone.",0.0
"You can trade with us, for we are great traders and explorers.",0.0
Nemta nodded.,0.0
"See you aboard techy!""",0.0
The majority of my social network graduated and went to grad school; I stayed an extra year for a dual degree.,0.0
I feel regret.,1.0
It's just this self realization that hit me yes I don't have anything.,1.0
We ended up taking it to a mechanic and he gave up looking for the problem after three days.,0.0
"I finally started recovering from depression, everything was going great.",0.0
I don't have friends.,0.0
"Oblivious to the predator lurking within the shadows, the two of them shoot the shit with one another.",0.0
But I dont.,0.0
I'm a 14 year old female btw.,0.0
A lot of the time I fucking hate life.,1.0
I said I don't do any of these.,0.0
Because school is out now there are no other student job positions open.,0.0
"There is a huge, deep, and very dangerous river that runs though out town, there is also a lot of woods, mountains, cliffs, animals, and finally dangerous roads.",0.0
"One week later, after attempting to talk to the local supervisor they suspended me mid-notice period.",0.0
We never gave him our information at all.,0.0
"Also, I normally pay my rent automatically with recurring monthly payments.",0.0
Only one person can claim the top spot.,0.0
"Shut your mouth.” The barmaid swatted at the drunkard

The man smiled, “well, well an enterprising individual.”

The man tossed Vurgoth a large purse, a little shake, “There is a path off the road heading north, he is holed up in the cave up there.",0.0
You do you.,0.0
I recently married last month and my husband can't take mt own negativity that he even said go kill myself if I want.,0.0
Did he anticipate me finding out about it?,0.0
I feel like no one cares.,0.0
Why do people get off on being rude?,0.0
My boyfriend works overtime while I stay home drowning myself in tears.,1.0
I have many friends (none of whom know about my pain because I have seen them deal with similar situations with their friends and I wouldn't even waste our time.),1.0
"Or I sometimes fear that if, by happenstance, a murder happens near me and I'm somehow put forward as a suspect, they'll similarly look at my interests and Internet history and be like ""yup, must be him.",0.0
She was soaking wet.,0.0
"The curving towers **moved** as it watched, realizing that rather than simply being decorative structures, they were in fact an enormous set of pincers.",0.0
"Enough humans came through, with enough knowledge, that they could harvest the required materials from the surroundings, and use them to make stuff.",0.0
"After a little while on these new drugs (again, month or so) I notice that I am experiencing terrible anxiety when I'm at school and as soon as I get home, I'm fine for like an hour then I just get incredibly depressed.",1.0
The injuries were not consistent with injuries seen in a car accident.,0.0
"Sarcastic, ok.",0.0
When does it get better?,1.0
"Everything is bouncy, upbeat and erratic as if the film itself is fueled by the same mountains of cocaine that were used to write and direct it.",0.0
"Even if you find you are uninterested in my story, I cannot recommend royal road highly enough as a collection of web novels and fanfiction if you have any interest in stories about fantasy, sci-fi, or other fantastical elements.",0.0
"I don't need to know you name, age, location, gender, anything like that to do everything in my completely normal humanly power to remind you life is always worth living.",0.0
"""Surely that's far back in the past.",0.0
The other survivors had each given him a little of their own aerogel from their own nests.,0.0
"My parents have told me multiple times that I'm a failure and a loser, I've worked the same damn job for 5 years and have gotten nowhere, after one particular girl I'm terrified of relationships and my future is looking pretty empty.",1.0
I did.,0.0
"It stretched up to the heavens, down into darkness, and there seemed to be no beginning or end to its reach.",0.0
the highest highs aren't worth the slightest lows.,0.0
I have so many mixed feelings and I don’t know what to do,1.0
"Especially when I think about life milestones, like graduating school, getting a job, getting married, retirement.",0.0
I know this is gonna be harsh but I envy people who are depressed without a reason.,1.0
Maybe I really am way more than I can see of myself.,0.0
"I don’t have the mental energy to be around my friends anymore, and it seems like it only gets worse.",1.0
"I've spent this weekend hoped up in my room, sitting in bed, feeling like shit, and doing nothing.",1.0
"There's no real career path I'm interested in, and entry level office jobs that I would at least be able to tolerate are so far out of reach that it makes me upset.",1.0
"Oppal spun to embrace Squishy, just as he dropped the nailgun and lifted the child into his arms.",0.0
I dont know if this is like universal with people with depression but dose anyone feel like in their chest theres nothing?,1.0
I don't know the person behind this name.,0.0
My problem is the following...,0.0
"Like, I want to turn into a white person.",0.0
"This was an entirely new phenomenon for Italy, one that needed an entirely new investigative method.",0.0
Cops come to my house take my info ask if I need ambulance( I said no).,0.0
And his teeth were weirdly flat.,0.0
Does anyone have an explain for as to why I feel like I don’t have interest in anything and why I can never bring myself to eat.,1.0
"""Maybe she is wealthy?",0.0
"He tells me to always say what’s wrong, and when I do he gets so mad because 90% of the time it’s because of him.",0.0
Has anyone else every thought or felt like this?,0.0
I feel like I'm being judged for crying wolf.,0.0
"WARNING* if you are triggered by thoughts of suicide or self harm please don’t read this

I wouldn’t say my life has been particularly tough...except the past few years.",1.0
It frustrates me so much because it prevents me from doing the things I want to do.,0.0
"Hey, everybody.",0.0
