SentimentText,Sentiment
We are not weak.,0.0
Don’t be alone with him.,0.0
"Looking for answers of this sort, funny answers, self deprecating ones are most welcome, any answer is fine.",0.0
"As of this post, the total rewrite is _220_ parts long and _943,000+ words_.",0.0
My readouts are starting to shriek at me.,0.0
It's a weird feeling.,0.0
"Whilst the concept of the fingerprint was foreign to the elves, every living being left a trace of magic on whatever they touched.",0.0
How does this work or does it.,0.0
"There was no sign of his friends, no sign of a rescue, nothing.",0.0
She didn't give him a chance to respond and turned to Jorin.,0.0
But I don't want it.,0.0
"No danger existed in the apartment-- that is, until I entered into the room.",1.0
Just overwhelmed have the weight of the world on my shoulders.,0.0
His birthday is on the 5th.,0.0
"Tanner told the Portuguese police, but they did not pass the description to the media until 25 May.",0.0
This made me go even deeper into my depression.,1.0
ufkc this.,0.0
"Living sucks, and im here for 4 people right now.",1.0
"I tend to make people laugh or smile when they are around me, but I don't consider my self as a funny guy.",0.0
I will see to it even knowing the cost it will ask of the Sheosayl.],0.0
I (23F) broke up with my boyfriend (26M) of 5 years a couple of months ago.,0.0
"A sort of living mind map landed in his head, every point on the map an event that could, and likely would happen.",0.0
(I genuinely hope Zach finally stopped eating straight butter.),0.0
I exclaimed.,0.0
Last year I confessed to my parents that I think I have anxiety.,1.0
"Within minutes, Jepthath arrives at the edge of a human village, one he helped fortify with wooden pallisades and other protective measures a year before.",0.0
She doesn't listen to logic or reason.,0.0
"I know for sure I don't come to people's minds much, never the first to be picked for anything or never the first one to be thought of if you mentioned the word 'friend' to anyone, if at all.",1.0
I can’t focus on my school work bc I can’t bring myself to care.,1.0
"My mom got really mad at my sister once and she threw her ipad, my dads phone, and hers into the backyard.",0.0
does your mind wander?,0.0
"unfortunately the appointment was late so i have no choice but to study here for a whole year( i dont speak their language, and because of that i technically will repeat a whole year so for example im supposed to be at grade 8 but because of language problems im currently grade 7) and that made me sad since im losing a year because of a fcking visa that i dont really need, so there is that and next is my step dad i think he lowkey hates me when he is drunk or just pissed on something he calls us pieces of shits, calling my mom slut,calling my grandma and grandpa a failure(my mom and i are from a 3rd world country and he lives in a 1st world country) ALMOST EVERYDAY THEY FIGHT there was a time when my step dad broke the tv, so my step dad was talking to my mom(my mom was hungry from work) she said ""come on let me eat first"" (but in italian) my step dad suddenly just smashed the fk out of the tv and said "" i didnt eat shit!""",1.0
I just feel empty.,1.0
"Truthfully, the people who want to help are just helping themselves, curing themselves of their conscience.",1.0
"The transition to mono-identism didn't work out for him like others.""",0.0
Im too scared to ask my dad if he’s ok. I’m literally crying cause that made me so so sad.,1.0
There is nothing or anyone who has been able to help me.,0.0
"I just miss when life didn't feel so dull, I feel overstimulated to where I hardly feel anything anymore.",1.0
A single?,0.0
"I pause for maybe a second or two, dreading what is to become of me.",1.0
And could he protect Madeline and Cani at the same time?,0.0
"“Just...” Madeline paused to put the heavy bundle on the bench next to her, “just weighs him down”

Cani gave Gabriel a skeptic look, “Why?”

“Madeline can tell you, or you can wait until we get out of this mess,” Gabriel said, and turned around to Zentra, “So, who am I fighting?”

“Her,” Zentra pointed to a tall Roniean female that just arrived, she was almost a head taller than the rest, Gabriel included.",0.0
What if he aggressively makes out with her as to overwhelm her?,0.0
I cannot explain the positive reviews of this series for the life of me.,0.0
It helped me greatly.,0.0
I was gone over two hours and he didn’t even notice.,0.0
An eye opening revelation.,0.0
That’s all I’ve been doing since I was 8.,0.0
"“Normally in our music the vocals either speak words to tell a story with the melody as background or they are used to create part of the melody itself, but in this piece, we see words used AS melody.",0.0
Like how life is never gonna be the same cause he was the only one i trusted and he was the only person who made me feel happy.,1.0
0 - 0 was the score.,0.0
Stuff no longer interests me.,1.0
My mom was still covered in his blood and explaining to the police what happened.,0.0
I’m an asshole.,0.0
"There was something unspeakably dispassionate about their expressions, as if they were performing a mindless chore.",0.0
And again.,0.0
The other two grabbed their weapons and aimed them at the airlock as Vorlax joined them.,0.0
But then I notice something even stranger.,0.0
"The Federation, her Federation, had actually arranged for a Terran bio-weapon to ravage the humans.",0.0
I don't know what to do anymore.,1.0
Did you bother to look?,0.0
I ruin everything I’m around and I’ve been trying so hard to make people happy but all I do is annoy everyone.,1.0
"We went through so much, my mothers salary wasn’t much it barely helped us.",1.0
"She was found wearing a singlet with a design of an apple, blue sports shorts and ""light coloured"" underwear.",0.0
Made a shopping list.,0.0
"I restrained my impulse to turn my head, to watch what she was doing behind my back, trying my best to trust that should she try something, the judicial military agents with me would put a prompt end to it.",0.0
"Now steel yourselves soldiers of the Imperium, prepare yourselves for something we almost forgot.",0.0
Nemta asked.,0.0
"He's been making digs at me for the past 2 years and because of the comment on my mental state, I snapped.",0.0
Thank Soltris.,0.0
"When I have all this friendship willing to give, I have nobody to receive it.",0.0
Now I really hit rock bottom again.,1.0
This was not the sort of neighborhood you wanted to be in at any time of the day.,0.0
"Tall, like 1.85 meters tall, white skin, blond hair now slicked back, recently cut.",0.0
I don’t have classes with the few people I’m friends with and I don’t make friends easily because I am not the one to make the first move and I cower behind a mental wall if someone talks to me.,1.0
"The inappropriate righteousness put myself outcast several times in school and thereafter, ended up with depression and anxiety, became highly reclusive and socially awkward.",1.0
My wife started to have feelings for a friend of ours in a social group we have.,0.0
"ooooh, it's not worthy of the day.",0.0
I don’t have the strength to keep picking myself up and glueing myself back together.,1.0
I'm 17.,0.0
Wiremu shuddered.,0.0
"""I tried to take a look in his mind while we were riding back,"" he explained, and I had the sudden urge to leap off the balcony and crush the man to death.",0.0
"Did the AI scare them off?-

-The Glint, a fiction made to promote the guild prerogative?-

-Why the Glint didn't want to meet.",0.0
Indistinguishable from my own if you didn't have a microscope.,0.0
I still feel the pain in my heart I still see their smiles behind my eyes.,0.0
"Not because I want to be fashionably late, but because it would look better if I approached *her* off the street rather than the other way around.",0.0
I just want to tell you all that I love you.,0.0
"Frida did not allow him to explain Heaven's situation to me, but even without him making explicit statements, I was able to glean a hint of the devastation Satan had unleashed._

Suddenly, the air inside the chamber becomes noticeably less stale.",0.0
"Then I went in to see the psychiatrist again and he told me that was really great improvement, especially because my dose is low , and thats not typical.",0.0
I feel sad but not to the point that I am depressed although I do breakdown occasionally.,1.0
"The only ones that even know our close friends that we shared together, and our families.",0.0
The dog that the human had been tempting ventured from the porch it had been lazing upon and lolloped over to the small human and barked eagerly.,0.0
I would like to lay in my own bed and just chill.,0.0
"I raised it, and slamed it on the table!",1.0
"I wake up in the same fucking bed, around the same fucking people, with the same fucking feeling day after day.",1.0
"I communicated this to them, and they told me there is no possible way to get out of my lease under any circumstances.",0.0
Her parents were appalled at what she decided.,0.0
My best friend ignores my texts and I’ve got no one left.,1.0
"honestly, im getting sick mentally.",0.0
You only feel like this now because you're drinking.,0.0
Missing for 7 years and still no leads.,0.0
"“It is time to see who in this city still possesses a soul.”

&nbsp;

It was another of Squishy’s uncanny talents.",0.0
"&#x200B;

i feel sad thinking about myself.",0.0
"I love myself as a person, but I hate my life a therapist isn't helping and my life is upside down and my boyfriend left 2 and half weeks ago and all I want is just someone to tell me it'll be okay because for the past two days I can't stop crying.",1.0
"""Twenty nine.""",0.0
i hate noise and being with so many children and i dislike dealing with children.,1.0
I cant help it some days are easier other days I dont want to leave my bed.,1.0
It don't make sense to me.,0.0
"E. Please either submit plain text or a gDoc link (please no .docx, .doc, .pdfs this time).",0.0
"It was the long sword that both knights now favoured, each with a gauntleted hand resting lightly on the hilt.",0.0
I'm basically just a servant.,1.0
My whole life has been hell and I’m just tired.,1.0
"i’m too young to die, to young to feel like this aren’t i?",1.0
The overlay indicated where the dead planet was relative to it’ star and the rest of its system.,0.0
"But, hopefully not till there old enough to handle it.",0.0
I’m probably mentally ill.,1.0
"I can't get anything done, I don't want to get out of bed most of the time.",1.0
"""Yo!",0.0
Imagine being a war hero for your country and then serving 20 years of your life in prison because you disagreed on policy.,0.0
:|,0.0
"but as time passes by, our lives become harder as we mature, and we slowly become apart from each other.",0.0
"and when I do, we get carried away on unrelated bullshit... then they prescribe meds that don't do a fucking thing... hell I can't even overdose on them...",1.0
"She and Seth were so tightly wound, she could feel the straps on his chest, the way they held him to the chair.",0.0
They also threaten to tell my dad and uncle if I don't listen to them.,0.0
Or maybe we simply don't deserve life at all.,1.0
"The Russians did the same, and both ships set off to hunt for new targets.",0.0
All I do is hurt the ones I love.,1.0
I was lost.,0.0
If i where to disappear there would be nothing other than my family getting hurt.,0.0
"Consequently, similar to a roller coaster rising and falling, I always go back into these dark states.",0.0
"I like how when your friend is sad and down you try to help them, but when you are sad and down your friends dont wont to help and dont care.",1.0
"I'm going to miss having a family, having a little brother.",1.0
"She got mad and felt awkward(she shown the convesation with my friend) i tried to apologize, she didn't even opend the mess conversation, so the last text from me is ""Sorry for everything""(this sentence says a lot of things,for me).",1.0
"I hate living, but im here for the things I love doing.",1.0
This next part was always the hardest for me.,0.0
The rattling sound of chains soon followed.,0.0
"All I really did was break my pencil, so I guess I managed to gain control again.",0.0
"I have everyday scary thoughts that i would like to forget, which are based on the idea that my chronic health conditions are untreatable.",1.0
My mother and I have a lot better of a relationship but she doesn't like talking to me or hugging me.,1.0
I’m gonna lose everything I have because I can’t control my emotions.,1.0
A while back I somehow came across a Kardashian (idk which one) interview while scrolling through the channels on TV.,0.0
I can see she struggles to smile when I am being mean to her.,0.0
"I immediately thought to myself, ""how does he know how to sneak into the attic?",0.0
I keep waiting to wake up and realise this was all but a bad dream.,1.0
"On March 23, three days later, she called Brianna’s parents, asking them about Brianna, and it was then that everyone realized that she was missing.",0.0
There are only a few things that happen if I die tonight.,1.0
"I can’t do it though, I don’t want to hurt my brothers and sisters even more than I already have.",1.0
And this movie is 80’as fuck!,0.0
I do want to meet new people and make friends.,0.0
Really sucks sometimes.,0.0
"I can’t convince myself that life is worth living and that anyone benefits from having me around 
I have no self worth
I can’t stand feeling so unbearably depressed and I’ve been cutting and drinking to try and distract myself and it’s gotten so bad I’ve started drinking at school.",1.0
"The were found in Sheridan and Sweetwater County, respectively.",0.0
"I wanna kill myself, how can a FUCKING TEST make me feel so pathetic.",1.0
I wanna die,1.0
It's the worst thing ever.,1.0
"Instead, its thought Peter stayed on the train and alighted at the train's final destination - Euston Station, in London.",0.0
"I isolate myself from others, from my friends I haven’t talked to them in a week.",1.0
an i’m sorry💞,1.0
Today I really was at my end.,1.0
I know I can't go on day after day depressed.,1.0
That job put me in such financial difficulties and now I'm finally sorting out my money problems.,0.0
I had gotten a job somewhere in September and another friend bought me a gym membership so I could shower there and still work.,0.0
That'd be nice.,0.0
"In a way we are stubborn, saying no to the norm, but those wallowing in the norm see us and wonder how they do it, just like we wondered how our role models did it.",0.0
"Nemta was aware the sun had set, the only light was from the fire around the creation engine.",0.0
I have to look at the brighter picture and battle through this hardship.,1.0
I also have asthma so I didn't want to risk that at all.,0.0
I screwed up the other day.,1.0
I’m still hurting and I just don’t feel like I have the energy to let people in again like that.,1.0
My head begins to feel light and swirly.,0.0
I started to walk back to my apartment and she followed me I told her to “get the fuck away from me” this lady had no business being by my building because her building was 3 blocks away and she always tried to Start shit with me and my brother.,0.0
I can't drink anymore because of medication but I'm not even getting healthier because I just stress eat and stress smoke cigarettes.,1.0
I don’t enjoy anything anymore.,1.0
Many questions about this case.,0.0
All my peers are thriving and living their lie adulting hile I'm over here weeping over my miserable ife.,1.0
I was 7-12years old throughout all this things.,0.0
"I don't want to do anything in my life, I lost my interest for most of the things I enjoyed and I am starting to lose my friends.",1.0
"Now, listen to this.",0.0
I had texted a couple of them asking if they wanted to hang out tonight and they said they’d let me know if we were all doing something tonight.,0.0
I have no idea if he has any insurance (it seems he doesn't) and so far all exchanges with the friend have been through the roommate.,0.0
The woman who I thought was going to be the end-all-be-all in my life and in hers.,0.0
"I opened up to these people about my struggle slightly out of desperation and they beraded me with insults and accusations of (paraphrase)""farming for pity"" and taking advantage of them like some sort of master manipulator.",1.0
"A victim of attrition, I suppose, as a full time college student.",0.0
NO MATTER WHAT AND YOU CAN ALWAYS BE BETTER.INTERNALLY OR EXTERNALLY THERE IS ALWAYS AKWAYS ROOM FOR IMPROVEMENT.YOUR HIGHER SELF WANTS YOU TO ASCEND.THE SITUATION YOU ARE IN RIGHT NOW IS MEANT TO BE.IT IS SUPPOSE TO SERVE YOU OR TEACH YOU.YOU ARE NOT READING THIS WHOLE THING BY COINCIDENCE YOU ARE MEANT TO SEE THIS AS A SIGN THAT YOU ARE LOVED UNCONDITIONALLY.PLEASE BELIEVE AND REMEMBER I LOVE AND ACCEPT YOU COMPLETELY I DONT CARE HOW YOU LOOK INSIDE AND OUT.,0.0
"I wish I could cry, but I’m so accustomed to just keeping it in that I almost literally cannot cry about it, also because I feel like I’m not special at all because of how much people are more depressed than me about worse stuff.",1.0
I really appreciate it if you read the whole thing.,0.0
But I wanted to ask you if it was okay to take Dani for a ride on a rock-hopper.,0.0
"Every time she does this, things escalate until the cops are called, and even then, most of the time, the cops give her a stern talking to and leave, only for her to start shouting and breaking things immediately afterwards.",0.0
I look to the time-keeper.,0.0
Its so strange that before he was even abducted..I sensed something bad was gonna happen to him..I had began getting stronger...restarted no fap..began eating healthy and began running..now that it has happened I feel overwhelmed.,1.0
She said she too had a crush on me.,0.0
"I never had many friends, relationships and high school was a bit of a drag, as it is for most i'm sure..

&#x200B;

I took a year to myself then started at a tech school, it was going well... 3 semesters away from graduation, the school shut down ... the entire chain.",1.0
I should be happy I live in a house I don't have problems w my friends or my parents.,1.0
"All these explanations were so fragile--it would only take one to break the pattern, only one to buck the trend, only one to slip and make a *mistake,* and then the aliens would be spotted.",0.0
I just think that there's a low probability that the person you're destined to be with lives in the same city or even state as you do.,0.0
Is this legal?,0.0
"Art thou laying claim to this mortal saving thee from the jowls of the demons?""",0.0
To not shine a light when you hear a gutteral growl near you in the woods.,0.0
"*

My next steps came with some more confidence, and I approached the row of land vehicles of surprisingly oversized wheels, and the small welcoming party next to them.",0.0
The waiter now was completely regretful for attending this table.,0.0
A lot of the time I feel like I have no one there and there's no where to go but farther down.,0.0
"For example, if I wanted to sell coffee could my domain name be [www.coffee.com](http://www.coffee.com/) or if I wanted to sell bikes in the UK could my domain name be [www.bikes.co.uk](http://www.bikes.co.uk/)?",0.0
He tells me hes tired of the same argument with no result.,0.0
I wish I wouldn't have taken her for granted.,0.0
He felt compelled to tell her.,0.0
*{Believe it or not there’s nothing romantic between Maggie and I.,0.0
It was probably my happiest couple of day ever.,0.0
"I'm 20 lbs over weight (not really that bad I know) so no clothes fit, so getting dressed is near impossible, everything is uncomfortable.",0.0
"YES THREATENED... at this point I just wish they would just kill me...

&#x200B;

Skip forward a year... at this point I started counselling and they prescribed me Cymbalta.. \[an anti-depressant\] because I was constantly crying..",1.0
You are enough.,0.0
TLDR: My life sucked four years ago.,0.0
Am I right for feeling this way?,0.0
It probably looked really strange.,0.0
"I wish I could just get a meaningless call center/office job and put in my 9-5 everyday and then do what things I enjoy.. but those jobs seem so far out of reach, despite them only being entry level.",0.0
Woken by an angry Captain who was demanding an explanation as to why the replicators in the human’s suite had produced toxic fruit used in weapon manufacturing.,0.0
"I made 2 good friends, and they always think of me as a happy go lucky girl with no stress, but they don't know that I cry almost everyday at home and to sleep.",1.0
"I don't really get excited about anything, and I can never express things outwardly.",1.0
"Yes, when I talk about school I mean like I’m 13.",0.0
It's been over 6 months since the flood and I still cry myself asleep every night.,1.0
"ever - and now my mum's got a phone call, at least I'm expecting her to get one anytime soon, because the nurse said she'll call her today.",0.0
We were coming up.,0.0
"The kids I go to school with all do the most retarted (actual definition, not insult way) crap and it makes me slouch everyday, giving up on humanity more and more.",1.0
"She had hoped to let them recover fully, but such thoughts were for yesterday when the KoTry were still keeping their distance.",0.0
people say she was with u .,0.0
Nemta finally turned to look and saw that Friend Terry was sitting on the ground.,0.0
I think I subconsciously became more depressed because I should feel that way and my improvement was abnormal.,1.0
"However, the next 3years I was bullied for almost every single day.",0.0
Why should we pick you?,0.0
It's fucking surreal and I feel the same as before.,1.0
"That, is what hurts me the most.",0.0
A numerical series was tattooed on the base of her neck and a strange series of shaded lines below the numbers.,0.0
I try to be nice and I try to do everything for everyone.,0.0
A year goes by and my surgeon tells me he was wrong.,0.0
"I plan on having him take his pilgrimage soon, you see.",0.0
It's hard to live with the fact that I hurt the woman I thought I would be with forever and it hurts even more to still love her as much as I did a year ago when things were good while she's drifted apart.,1.0
My thoughts back then were focused somewhere on true perfection being slightly and unexpectedly flawed.,0.0
I need someone to talk to.,1.0
"Also, I'm not American so I won't be (intentionally) using American English, I hope that won't be an issue.",0.0
A father who’s name it took you years to learn is even less convent.,0.0
But then what about the subconscious?,0.0
"When she's off her meds, though, she smashes/stabs holes in the walls, breaks stuff, screams obscenities and slurs at imaginary people, and threatens to kill anyone who tries to get her to calm down, no matter how gently they do it.",0.0
I'm becoming more and more aware that those relationships will always be strained and there is nothing I can do to fix it.,0.0
"**\[Engines\]** a rumbling is heard as the engineer begins to choke the engine,

\*CH CH CH CH CH... CH CH CH CH CH..\*

A slight grumble is heard before the engines roar to life!",0.0
I hadn’t been that happy in years.,0.0
"Even now you're dying, your mind and core code is fragmenting and you don't even know it do you?",0.0
"“Arjun figured it out?”

Mark snorted.",0.0
*Over my cold dead body!,0.0
My life fell apart as all my friends began to resent me,1.0
Is that why you make up these stupid things about yourself?,0.0
It will never come.,0.0
Not just the colors we see.,0.0
She called me at 1 asking if she could spend the night so she could be woken up for work.,0.0
I was cool with that.,0.0
Mozzan flinched and pushed her mind to the next system.,0.0
I felt happy about myself.,0.0
"They departed Amarillo on the 28th of January, leaving David at home alone for the next couple of days.",0.0
I'm trying to take my own advice but I'm really struggling man.,0.0
A life-form worth envying in this world indeed...,0.0
This level of competitiveness slowly turned into sadness.,1.0
"I have my own goals I'm still working towards and I just want to say, that's one thing that helps.",0.0
"She claimed that they attempted to kill her son, and that she knew Adam was murdered in London by his parents.",0.0
"And although fully clothed,  her clothing had been removed and put back on at some point as certain fastenings weren’t secured correctly.",0.0
Starving because I just couldn't leave the safe haven of my bedroom.,1.0
He had an alibi but his girlfriend refuted it which is what solidified his conviction.,0.0
I’d rather attempt suicide one more time and actually be successful than do that.,1.0
"After college, I worked at big companies like Amazon, a large credit card company and then Google.",0.0
I couldn't keep up with her she said.,0.0
Can’t see the goddam signs right in front of my face.,0.0
I hate myself.,1.0
"Almost immediately, one by one, those who I loved the most, and those who I did not realized loved me, sent the warmest messages of support.",0.0
"“We can use our anti-air lasers to strike at the main cannon, putting it out of commission,” answered the captain.",0.0
No survivors.,0.0
"I don't expect sex, I want it to be consensual, I want it to be special, I WANT TO BE WANTED.",1.0
The Ancient Enemy screamed its warcry and as one the two sisters denied it.,0.0
"But flat out arrogant assholes really throw me, and I instantly get thrown back in to my own depression.",1.0
"Well, she fell in love with me so much, that she changed her mind and actually asked if we could.",0.0
"This giant is different, though.",0.0
Get.,0.0
*,0.0
I want to get up but I’ve forgotten how to function.,1.0
I should let you guys know that I am from a muslim family but I consider myself as atheist and never told my parents or anyone.,0.0
