SentimentText,Sentiment
Now my friends that run the acc with me are not encouraged at all.,0.0
"Other than being bullied in school, I was bullied by my three cousins.",0.0
"-Fourth and to me, one of the most concerning of events...early in the morning hours, a dim flashlight is seen in the woods coming closer to the campsite.",0.0
"The tribe could not have afforded to feed so many… unneeded animals, and most would have likely been food, rather than be fed.",0.0
I graduated this month but I didn't attend.,1.0
"Just last week April 29, 2020 he sold the car that he traded from my brother and bought another car.",0.0
"**

The person walking around the church does not look worried about possibly triggering some kind of silent alarm to the police as they appear to take their time.",0.0
"And if so, why didn't I see them?",1.0
Completely unacceptable.,0.0
I've been getting more and more insecure about everything.,1.0
Fuck Eli Roths movies the gore doesnt justify the waste of time the rest of the movie.,0.0
Stay strong guys.,0.0
After they get paid.,0.0
"When I look outside or am outside,  I just don’t feel happy.",1.0
One moment I feel like I'm on top of the world and things are getting better and then reality comes back to crush all of that positivity and hope into dust.,1.0
I can’t ever see myself being truly happy after the last year and a half.,1.0
I have a year left on my supervised probation.,1.0
"I'm about to finish high school, I'm going to a great college because I worked my ass off for it, I have so many friends, my family is so supportive... and I still feel *so* empty, *so* dead, *so* bored of myself.",1.0
And every day it's wake up.,0.0
"It was closure,"" said Savitskoff about the moment his search team found Rooney's body.",0.0
I wish I knew who I was.,0.0
We'll see how this meat reality plays out.,1.0
"I feel like I go out of my way, but get nothing in return aside from irritation.",1.0
Sol?,0.0
"""I see.",0.0
How can 5 of the closest friends ever just leave like that.,0.0
I hate my major which is in IT and get sick when I have to program for web (literally breaking down and sometimes puking).,1.0
“So they’ve got Howles training Beta now?,0.0
I'm usually a calm person and I try to stay calm most of the time.,0.0
Definitely not myself.,1.0
Nemta asked.,0.0
"But Major didn't warn us that they'd fear us.""",0.0
Then I realised then I was actually getting motivated to change myself for the better and I liked it.,0.0
"But the thing is no one reported her missing until 1994, 13 years later.",0.0
"Bobo!""",0.0
L3,0.0
What do I do?,0.0
Things got better after that rough year but throughout my life I’ve always struggled with anxiety and low self esteem.,0.0
I wouldn't mind working 40 hours.,0.0
I can tell myself things but telling myself things doesn't invoke different emotions in me.,0.0
Please.,0.0
I hope I can hold on to this feeling and lock it up tight.,0.0
"I regret it, at the same time I don't.",0.0
I try to keep my trauma and sad parts of me hidden to make me more likable but apparently.,1.0
“It was your lunch break not your naptime.,0.0
"To the Duke's disbelief, Jepthath breaks through his defenses and fractures Bael's left humerus.",0.0
Even if it was never my fault.,0.0
A desert?,0.0
I feel like I'm not very memorable.,1.0
So why did my life end up so fucked up?,1.0
"The days are becoming a blur, I have uni assignments to do but I don't have the motivation to do so.",0.0
I been gave up having a girlfriend because I'm too unperfect and real and I make them know that too soon.,1.0
"She was last seen on a street corner wearing blue jeans, and a pink sleeveless sweatshirt.",0.0
From bullets *and* ideas.,0.0
"Typically I'll just sit at the PC, stare at some ROMs/ISOs from my past and download them then I load and play for 5 minutes and just close the emulator.",1.0
"It's okay to be suicidal, have suicidal thought, for many of us, it's normal, but you have to talk to people, even if it's just in the comments on a subreddit.",1.0
"I always know that things are going to get better, I know I won't be in this much pain constantly but I don't know if it's worth it.",1.0
"I don’t know what I mean by that, but I just really want to stay where I am right now.",0.0
"My grades dropped as I became lazy, and stops doing homework, my teacher called my parents up, and I get cane almost every month by my dad.",1.0
"After all, if your Ai looses, boom suddenly your enemies have a fun new toy to play around with.",0.0
The hall drank up the sound of his question as it was barely past his lips.,0.0
My 56 year old mom was diagnosed with stage 4 breast cancer a week before Christmas 2017.,1.0
I figure if I make my death seem like an accident then I won't feel so guilty and people won't blame themselves.,1.0
The little guy is in so much pain and is going to be out of action for two months.,1.0
"*

Leaving the scene, I had a twinge of that fear, anxiety, and excitement that had always accompanied taking risks and being somewhere I didn’t belong.",0.0
I love you but but I don’t know how to love you.,0.0
not sure what’s my point for this!,0.0
Honestly I feel so lost rn.,1.0
It was his first true assignment out in the depths of space.,0.0
I bring so much negativity to my wife’s life that she can’t bear anymore negativity.,0.0
My friend has talked to them and says that they want to talk it out but despite how close I am to all of them I just don’t feel that I can really fix this by talking even though I know it’s probably all my fault.,0.0
Life has kicked the shit out of me for so long now that I can't feel anything anymore.,1.0
"Little more than an ugly square box, it lacks any furnishings or decorations, but does possess a series of slits on its walls, allowing traces of Heaven's Light to slip inside and illuminate its interior.",0.0
"But I know that I’ll have a very miserable night tonight when I get back home because my living conditions are atrocious due to poor insulation in my room, which overwhelms my Misophonia (irritability of certain noises).",1.0
"   
Halli I'm 14 years old and I do not want to live anymore.",1.0
"What force drove the creature to ignore food in its travels, and what hand guided it to Ogrimmar, remain a mystery.",0.0
One of them have migrated.,0.0
"He reacted with no emotion, no apology, no nothing.",1.0
"They watched in quiet wonder as a young- or perhaps just particularly short human, crouched down and began making a clicking noise while holding out a bone of some sort.",0.0
Mox held up 2 fingers on her right hand and then 2 on the left.,0.0
That no matter how I try to fix things they’ll stay the way they are.,1.0
To return after 7 of our life cycles.,0.0
Absolutely nothing.,0.0
"We have come in peace, after all.""",0.0
Force yourself to do those small things you enjoy.,0.0
Things that should make you joyful won't.,0.0
"Oh thats right, because I look like a potato on the outside and the inside isn't much better, and my kind of people don't deserve love.",1.0
"LTDR: I can't get off the couch, I'm worthless, I don't know how to break the cycle.",1.0
I think about ending it all everyday but I don’t want to be selfish or make anyone feel bad.,1.0
"""You elves often ignore the tiny little things to chase the big and grand trophy - unaware of all those small… traps laid in front of you.""",0.0
I (17) told her my life was more shitty than her's.,1.0
"I want to smile, but this backdoor spike in my life keeps attacking me whenever I succumb to my manic state of mild happiness; thus leaving me always feeling as if I’m in an underworld of sorts... where my head is flooded with dark clouds, awful past memories and the worries of long gone friends.",1.0
"“I wanted to show you an example of what we admire.”

He paused as he looked at Karashel expectantly.",0.0
"It all tends to make me force myself into isolation, and I need to get over my ego before I get myself or others possibly hurt.",1.0
"If I tell her that I think a shirt is ugly and I don't want to try it on, then I shouldn't try it on because we won't get it anyway, but her response is ""I said to"" 

If I tell her I'm using my laptop, my sister has two, and is currently asleep, not using either laptop, use one of hers, she says ""No I want yours""

I always present things in a calm voice with logical reasoning and she finds it disrespectful that I don't just do everything she says at the drop of a hat.",0.0
"“I’m not sure I do either,” she said.",0.0
"Just want someone to appreciate my efforts, that's all.",1.0
"Why am I here
Why does no one hear?",0.0
"Through my spread fingers, I caught a glimpse of a dark blue.",0.0
"The last one in the line obliged, slamming his club into her left shoulder.",0.0
Caw smiled.,0.0
I just get the urge to clean out my bank accounts and just disappearing.,0.0
I’ve been crying at everything and I just want it to stop.,1.0
"According to one of his sexual abuse victims, he told her that he would ""make her disappear"" if she told the police.",0.0
This might be hard to grasp the concept of but just try it.,0.0
I just feel like giving up.,1.0
"When you open your account, they ask you what your net worth is and your risk tolerance.",0.0
"Once on the plane, he contacted a flight attendant and said he had a bomb, then opened his briefcase and showed her what appeared to be a bomb.",0.0
That won't happen when living with depression.,1.0
"I find myself not clicking with anyone, not able to talk.",1.0
she said god will punish me for my actions but how is speaking logically and explaining things reasonably a sin.,0.0
I am 23 years old (I am 5'4 and weigh 120 lbs) and I never get approached and men pretty much never flirt with me and I have never even had a guy ask for my number before.,1.0
I do it with the intention the feeling of joy is the key to suppressing depression and fixing the way I see and feel.,1.0
"He could not have gotten this far without Squishy, of course.",0.0
I shook my head.,0.0
"she told she coulnd't she was busy, i still ask what day she wasn't busy ""all of tehm i'm busy"" was the answer... it was like everything started again, i even got fever... and now i'm here feeling worst than before, i would have been happy (or at least have a normal life) facing my old demons, but facing them and losing her it's killing me... don't know what more to ad... thanks for reading me.",1.0
"There are so many thoughts in my head I can’t communicate them, even now it’s coming out all jumbled.",1.0
She wanted to wait for intercourse until she was married aswell.,0.0
I was 14-17years old.,0.0
I want to go invisible.,1.0
"It was a terrible, necessary purge.",0.0
"""No.",0.0
"He had discussed ""the plug"" with his wife the day before.",0.0
"""It does give me a moment to deliver that to her.",0.0
I need someone to talk to.,1.0
"I still hardly talk to anyone, have no bonds, no connections.",1.0
Because I don’t want to be embarrassed to show my legs.,1.0
**\[Gunny\]** ignores the comm chatter to focus on his task.,0.0
"Everywhere I look around me, I can't help but notice how great everyone is.",0.0
Love ends.,1.0
It's weird.,1.0
Why does the world benefit people who dont do shit while they completely ignore the hard working people?,0.0
Just tired of feeling completely and utterly alone.,1.0
It's also the first time in years I've been at my family house so I thought it would be nice family around but sadly no.,1.0
"But in the last few days before the visit, he’s been cold and rejecting towards me and couldn’t commit to what time he would be here.",1.0
"I'm burning out, and I'm... concerned.",0.0
What are your thoughts on this case?,0.0
"&#x200B;

Nama: I would love to but my lesser developed brain is not up for the task let me put you on

hold and call for one off my managers.",0.0
"“Io, when the Lieutenant is cleared please send him to hydroponics bay number seven.",0.0
"I also have little motivation of studying, as I do the bare minimum when it comes to studying for school (trying to get my bachelor’s).",1.0
"Even if you were* able *to do it, could you bring yourself to do it?",0.0
it’s like i have this feeling that it’ll last forever and there’s nothing i can do to stop it.,1.0
I just want to make it through this.,0.0
"I always find myself slacking and procrastinating majority of the time, as I feel as though the purpose of studying is just pointless.",1.0
Not going to my uni lectures has now put me so far behind that i cant even imagine what it would be like going in now.,0.0
Embar roared.,0.0
The feeling that he was somewhere outside of the HEL despite knowing very well where he was did not sit well with him.,0.0
"When I learned of the first time a Legionnaire assaulted a series of helpless villager women, my blood boiled with rage.",0.0
About a year ago my depression was terrible.,1.0
"They kick him when he plays football (when he doesn't even have the ball), they poke his eyes for fun and keeps pushing him off the football field.",1.0
"This was a first time for me, anyway.",0.0
I feel like a disappointment to my family.,1.0
"Incidentally, based on the imagery we have exchanged, we must remark that your species bears a strong resemblance to our parent species.""",0.0
All my father could do was sit there and watch me as my eyes rolled back into my head and I started to die.,1.0
Hi reddit I just wanna to start out by saying how much 2020 has sucked the first thing the happens on the first  day of 2020 my grandpa died then Australia got set on fire then the corona virus and on January 26th 2020 my role model Kobe Bryant died I was a huge fan on febuary 16th 2020 my uncle died and I just want to say 2020 sucks,1.0
"My father snapped and told me mother he wants a divorce, he attitude changed completely once she realized he was serious, because she knew I would want to go with him and she cleaned up her act trying to act all nice and buy me things so I would break him more than she ever could but I didn’t and simply pushed back at her.",1.0
My t-shirt and trousers are stuck fast to my skin by a pretty miserable amount of sweat.,0.0
"I can't tell you the amount of times I think about ending it all, it's every day because my life feels like a nightmare.",1.0
I feel like crying every day.,1.0
His species had countless children every year with the death rate being incredibly high; child death was a fact of life.,0.0
I already switched majors once so doing it again and prolonging my school years is not an option.,1.0
Deeply.,0.0
I'm in an endless rut of wanting out of my life.,1.0
A console flickered to life.,0.0
"As with other things like breathing normal, walking without pain, heart pumping.",0.0
"Enslaving species!""",0.0
"“Like a plague, they descended upon us, and there would be no stopping them.",0.0
"But Ziv simply moved to the room's door, motioning us to follow her.",0.0
"im young, 22, but im struggling, i have no direction, I've lived with my parents since high school, bounced in and out of community college, worked here and there, but have nothing to show, ive lost all my money gambling, have 600 to my name, im depressed, can not get a girlfriend or hold a relationship, i really don't know what to do.",1.0
"from a mutual friends window, I cringe at myself remembering shouting ""Cool..."" and walking on.",0.0
"But in the back of my mind, I just hope that someone would actually...miss me.",1.0
"There had been discussion of the good, but the focus was on things he would have rather forgotten: Jess’ death, the crew’s funeral, the raid, and the slaying of the ursae.",0.0
I dont know what I want.,0.0
"Mood swings are a bitch, being too tired to talk is a bitch, memory problems are too.",1.0
This was months ago but it sent my already fragile emotional health into complete darkness.,1.0
I did not write this track but i have full ownership over it.,0.0
#NAME?,0.0
I’m so ashamed and embarrassed.,1.0
"The moment Lipper’s hand shot out and wrapped around Veera’s wrist the Omega Jumper leapt to action, clearing the distance between him and their group with frightening speed.",0.0
The thought of just not waking up isn’t so bad to me.,0.0
"My hand caught the wrist of his knife arm, and I brought my head forward and then snapped it back, driving the back of my head into his nose.",0.0
People like her have far more social/societal value than I do.,0.0
I just... hope things get better.,0.0
"One in particular, a Doe Network entry for David Glenn Lewis complete with a picture of the missing man, caught Ditter’s eye.",0.0
It's time we talked about Mental Health.,0.0
This time he says he’s going to leave my mom bc he can’t handle her kids and says he isn’t a coward who is just going to “take my bullshit” bc I’m the only one who sticks up for myself and he can’t handle not being in control.,0.0
"The tuxedo is obviously black and the bow tie also black, his slacks are of the slim type, they fit just right ending right before the shoes.",0.0
"Silver and gold metal, a strange purple solid goo connecting the metal limbs to her torso.",0.0
"I haven't yet contacted the family (who is not aware of this instagram account the student had), and I

For about half a year a high school freshman had an account on Instagram where he would post memes and the general basis of these memes was him committing suicide.",0.0
"I've been living like a degenerate for about half a year, but I finally managed to eek out the will to at least clean the garbage in my room a week ago.",0.0
Go to school.,0.0
"See, we do some online tests from time to time, just like all the others.",0.0
Any girl not fifteen kg's overweight.,0.0
Trying to hold back tears as we speak,1.0
I am 18-19years old then.,0.0
Ok continuing on came back from the war and tried school but couldn't decide on what I wanted so I started driving semi and that lasted a year before I got tired of it and got a factory job.,0.0
"‘Tell him that Alice saved his life.’

“What did he mean by that?” Mac wondered quietly.",0.0
Two whole goddamn million.,0.0
"And even if I wasn't rejected, I feel it would be unjust to the other person to deal with my current mental state.",1.0
"I walk past someone down the crowded streets 

And look at each person.",0.0
But now it’s wasted.,1.0
Out....,0.0
Am i this unfortunate?,0.0
Ambush or not the humans pesky resistance dies today.” I order.,0.0
That's too dangerous!,0.0
Stripped him naked and tied his hands and feet and gagged him with a piece of dirty rag I picked out of the dump.,0.0
Maybe a girl by my side.,0.0
My 7th year in that school (13years old) was good.,0.0
"So I could only eat things like mashed potatoes, ice cream, apple sauce, and the like.",0.0
"But March came around and, to quote the late Lemmy Kilmister, God was never on my side.",1.0
These locomotives still have 1850s style parts.,0.0
"I feel like I should just end everything since I know nobody will ever actually love me for me, and I know that I’ll just get taken advantage of again even if I leave my dad and sisters.",1.0
"I really enjoy this position, it is an a sector of engineering that is difficult to enter, especially early in college.",0.0
I love(d) her so much and it is the main reason as to why I bave had these negative thoughts.,0.0
Nine.,0.0
"I want to be happy, but at the same time I have this urge to just crawl back into this fucking shit hole I’ve dug myself in.",1.0
I'm lost.,1.0
Just to humour ourselves,0.0
Hi it's my birthday and I will celebrate it almost alone in quarantine.,0.0
How will I explain to him what happened?,1.0
"As you know, our fleet originates from the Laguun 2 system [coordinates attached].",0.0
I jus hope I’m ain’t going against the rule on here but I need friends to talk to right now cos I’m feeling some typo way bout myself .,1.0
"She was my angel and now because of my mistakes, it’s fucked.",1.0
I’m starting to scare myself; why am I not letting myself bring happiness into my life.,1.0
"**

Last week's winner was /u/tatticky with:

>The warrior races of the universe have gathered together an exhibit of their species' oldest surviving weapons.",0.0
"All they needed was a hair dryer, Kara.",0.0
i dont want this to be my fate.,1.0
"I was so broken, so damaged...self hatred grew by the day to the point I was planing my own suicide by hanging.",1.0
"man, i just want some friends",0.0
Or just acquire school debt like everyone else and it just all feels so helpless and pointless.,1.0
"You'll break their thought process all up, and you'll get them totally lost.",0.0
thanks for taking the time to hear this dumb rant about  shit you all probably went through or are going through.,1.0
"But everything was shut down now, all the buildings and streets, empty, quite and dark.",0.0
Today is a good example of what I mean.,0.0
“I don’t have an I-have-a-theory face” I responded indignantly.,0.0
"Eless looked to Seth, her mind brushing across his as she checked his willingness to try.",0.0
This is just a personal rant I needed to let out.,0.0
There are many ways to go about this.,0.0
"Good luck, Baulric.”

I pick up my bag and set foot on the wooden stairs, down into the hot dark.",0.0
"I always thought that was kind of hypocritical considering the things they’ll do to their own bodies in the name of progress and superiority, but hypocrisy is basically item number one in the Brotherhood playbook.",0.0
I wish I could tell her I love her.,0.0
"But, my troops are depleting.",0.0
"Idk life is just a box of chocolates, they're all full of shit.",1.0
I thought they would come true.,0.0
"When you realize that people who you consider your best friend, has other more important best friends.",1.0
"I cant find anything about Ronnie Ryan, if he was ever found or not.",0.0
"This reactor had multiple tube, conduits and wires leading off it in all directions.",0.0
"The dreams are so vivid, so powerful.",1.0
I can't say I feel sad because that ended months ago.,0.0
"Today, my goal is to do the same for my car and hell maybe even do my laundry.",0.0
"But several times a day I think about how easy it would be to jump in front of a car or train on my morning commute, how easily I could get lost in the woods by out house, how I could make it look like an accident.",1.0
"Baldwin, who has previously lived in Nashua, Iowa, and Springfield, Missouri, was a cross-country truck driver at the time of the killings.",0.0
"i considered self harm a few months ago, but i hasn’t recently because it’s like why bother?",1.0
"“Jarl Harot Has Charged You With Disturbing The Peace Of Durrikshield, Come Peacefully.”

One of the men turned to the leader, “He is not here, perhaps we should head back to town.",0.0
"I have thought about using it before, but I have contemplated it time and time again.....   (so hi reddit, particularly /r/depressed)

&#x200B;

When I graduated high school, at the age of 18, I decided to go to college to better my life, and present myself with better opportunities..",0.0
"But, long ago, in the time of your grandpa's grandpa's grandpa's grandpa's-- well, so many grandpas that you'd need an eleventh arm to count them all--long ago, there was nobody on this planet.",0.0
The brothers continued their exploration.,0.0
"I have a lot of people that claim we’re best friends, but I’m never invited to anything, nobody ever asks to hangout with me, nobody tries to text me out of nowhere, and in general I feel socially neglected.",1.0
"I feel like my soul has been dragged against its will into this world, which is ruled by psychos, in which you are born alone and you die alone and the society just throws a bunch of rules on top.",1.0
My body shudders and my mind goes blank.,1.0
"""We thank you, Illuminator,"" The village's chieftain says.",0.0
I've done nothing to earn it.,0.0
"I’d lose it all for another chance, another shot.",1.0
I don't want to end it like this.,1.0
I feel so helpless.,1.0
I don't even like myself.,1.0
"I'm snappy and irritable, and I'm just so tired.",1.0
"TDLR; Abused and bullied multiple times throughout, at school and at work.",0.0
I’m done.,1.0
"Thing is, this stuff doesn’t feel normal, and I’m not sure I want to eat it without getting to know it better.",0.0
"About 5 years ago I met my fiancée and things got better, but I couldn’t afford the antidepressants and antipsychotics anymore because I lost my Medicaid.",1.0
I make wrong comments.,0.0
I cry myself to sleep every night.,1.0
"Have a super fantastic day!”

From the door, the brainiac says, “It is also my wish that you have a super fantastic day!",0.0
I didn’t think it was a big deal.,0.0
Just a 4/10 looking guy.,1.0
I need antidepressants or something.,1.0
I get to see him this coming Monday.,0.0
Me: when?....,0.0
This is the second day I woke up feeling completely useless and just down.,1.0
I even hung out with one if them yesterday.,0.0
We split she kept him I went to Afghanistan.,0.0
"I miss him so much, and although people keep reassuring me that he lucked out, I just still feel so sad.",1.0
You dealing with a death is sad.,1.0
People helping people.,0.0
"The Ruk AI Snarled and attempted to attack, to throw the last of its processing power at its opponent in one last desperate gamble trying to do something, anything to bring it down.",0.0
"Last week, I quit my job after scrutiny of two weeks over my work output, being told it wasn’t enough etc although I worked hard and did my best.",1.0
"It is always there, sometimes less present than others, but it is always there.",1.0
“I think a field trip is in order.,0.0
Yeah that guy she gave me too sometimes hurt me but he also made me feel good too so it’s a win win.,0.0
"""Well, then you pick one!""",0.0
"Anyhow, my closest friends moved several states away and a few other oceans apart.",0.0
"He used to, but he doesnt now.",0.0
