SentimentText,Sentiment
I keep trying and scrambling to pull myself out of this pit but as soon as I'm almost out I get slammed into it again.,0.0
She messages me in the morning and says I'm coming home to get my stuff.,1.0
"“Let’s see, twentieth century Sol...” she mused as she started to expertly navigate through the archives.",0.0
"He could feel the eyes of the marines under his command on him, the eyes of the generals on the planet below on him.",0.0
"“The whole point of this excursion was to prove that.”

“Eshpurson?”

“Trip,” Karashel replied.",0.0
I am not visiting my counselor anymore.,1.0
"just wanna know is there others who have this ""problem"" lol",0.0
I have a great family and lots of friends but it doesn't matter I always feel this void in me like i'm missing something.,1.0
Share your experience!,0.0
And I can't do anything to truly say how sorry I am.,1.0
Things were actually going well for once in my life.,0.0
I’m starting to believe that I’m just the bad guy and that’s what I’ll always be.,1.0
Mauve it was the fact that I had to work today in what can only be described as the prolasped asshole area of Georgia.,0.0
Wondering if anybody knows good ways to deal with this kinda thing.,1.0
I went to my window and called my brother to direct them without being seen.,0.0
I’ve tried so hard for so long and it just won’t happen.,1.0
"Their ‘scientific method’ is a bit… um… well the aat make it work, kinda… but they do generate advances at a startling rate… somehow…” Caw laughed.",0.0
I just need to be alone for a few days.,1.0
I finished my degree.,0.0
We are too dissimilar.,0.0
And plan to go to the store.,0.0
"He was white, stood at 5’10”, and weighed around 168 pounds.",0.0
"I know this is ridiculous and nothing compared to the problems of some people, but I needed to get this out of my chest",0.0
Does anyone has a different world in their mind with sometimes same people that they see in thier life or sometimes even make people in their imagination and are only happy when they are in that world and just change when someone disturbs them?,1.0
I am alright i am not going to kill myself.,0.0
"They tend to say things like “we got you this and you’re still disrespectful.”
So i told them id rather not have anything
My dad then told me hes gonna pray that I get the job that I applied for so I can learn some work ethic (ive had two jobs in the past btw) 
They want me to do work around the house and I told them a positive work environment that makes you not want to die makes a difference in how you perform.",1.0
"Junior year I held up well, told myself it would get better, told my self I was just alone, not lonely.",1.0
She had been reported missing on March 17th but was killed on February 28th.,0.0
We never talked about it later...,0.0
"Once I got it situated the semester had already started at my uni, so I just decided to use their free counseling service for students.",0.0
I hate that cheesy shot.,0.0
It was around this time that I met my SO.,0.0
"""But it shall never be done.""",0.0
But never shows it.,0.0
"What I remember quite clearly from having the appliance was the fact that one of the bars, on the right side, that functions as essentially the support beam pushing my jaw forward, had a tendency to come out of its socket.",0.0
"Come, work with us so we can take down this Duke!""",0.0
I effected my parents and my closest friends.,1.0
"When he did, he really beat me up.",1.0
"&#x200B;

I am about halfway though college but I've haven't been taking classes for three semesters now.",0.0
"Plus we were like 11, so it wasn’t that serious anyway.)",0.0
However our school now ordered us to use our facecams in the Corona-School-Meetings.,0.0
"Fortunately, it's built in the centre of the area most people fall into.""",0.0
After he came back from test driving the car I told him that he and my brother would have to come to an agreement to see if they want to trade cars.,0.0
":D


---


The Precursor Harvester came out of Hellspace into a solar system from which it had detected transmissions suggesting the presence of intelligent life.",0.0
"Whether it's a hug, a girlfriend, a friend, anything.",0.0
""", says Harden as he walks into the bar followed by a  confused Mike.",0.0
Most of them.,0.0
I generally just don’t want to be alive anymore but I don’t want to die or kill myself and cause my friends and family that stress but I wish I could just A Wonderful Life myself and not ever have existed.,1.0
I'm not perfect and I've done a lot of things that I regret and always will but it's not too late to change.,0.0
"I want help, but no one really cares.",1.0
6 foot 3 250lb hairy emotional teddybear and all I want to do is lay in someone's lap and bawl my eyes out.,1.0
"Feeling disgusting because I just couldn't muster up the energy to shower, brush my hair and teeth.",1.0
"I let a very slight trickle of extra vitae into my veins, and direct it to focus on heat exchange.",0.0
I have been down for quite a while however I can’t even remember how this started.,1.0
I didn't give her what she needed.,1.0
"""To the hells with that thing!",0.0
"However, the hostile intent of the deep and reverberating voice which ponderously spoke was unmistakable.",0.0
"There are so many people to thank starting with our family and to those of you we now consider family, to people who have followed Eric’s story and have never even met him or us.",0.0
My life is bullshit.,1.0
It won’t come from anyone or anywhere else.,0.0
"""Don't sell yourself short, you're certainly more impressive than the usual fare,"" she assured me, ""But if you're surprised that I'm *not* surprised to see an otherworldly visitor, then don't be.",0.0
Sorry if there's part that is repeated.,0.0
"I've never been, but it kinda sounded fun so I agreed.",0.0
And it’s only worsened.,0.0
"Every day is like a repeating nightmare of waking up miserable, fighting to be happy, the pain and sorrow tearing me apart all over again, then trying so hard to sleep but never being able to because I can't stop thinking or feeling so many negative emotions at the same time.",1.0
"My only real support is a micromanager and her quiet husband, who (quite reasonably) must prioritize their children and their own struggle, my ex, who left me and got engaged with her prior ex within 4 days of leaving me, and a friend half the country away.",0.0
I don't know anything anymore.,1.0
Guess I'm invisible.,0.0
"Please, heed my warning before if you ever respond to it when it attempts to communicate with you, trusting it is a very fatal mistake, and not just for you.",0.0
I just want friends.,1.0
"""No.",0.0
"Friday night had come at last, it was time to escape my overbearing father and my checked-out mother, and head on back to Funtown, USA.",0.0
"He did find people to transfer though, luckily, but that didn’t solve our educational issue.",0.0
In it were clusters of small spheres.,0.0
With regards to the awkward walk - this could be down to boots that are too big.,0.0
"if not, you can find me in the Sanctum of Light.""",0.0
"i would lay in bed at night and just cry myself to sleep, praying for a better day tomorrow.",1.0
"""I was present at the briefing.",0.0
"But we decided to meet up and talk with each other again, because I told her it was not going so well with me after she contacted me again.",1.0
I hate this shitty feeling.,1.0
We pondered that idea for a while.,0.0
I want to die,1.0
"I won't make REAL friends or have any relationship because I have reduced myself to the 'school-shooter persona', even though I'm actually a friendly, approachable sweetheart.",0.0
I just dont enjoy anything anymore.,1.0
"They are dirty, tired, and their resolve is faltering from watching their comrades falling next to them, over and over.",0.0
I thought we clicked.,0.0
“Except then I’d be lying.,0.0
I can’t talk to anyone close because I fear that I will drain them.,1.0
"The other is trying to fight, writing this post, trying to actually do something about how I feel.",0.0
"I'm not enjoying myself at all, so I don't want to do it anymore.",1.0
"i have shared my darkest moments with them, and the fact that i dont see them anymore puts me in a state of loneliness.",1.0
I'm such a negative person.,0.0
"Ahem, main story.",0.0
"The 27th, this Saturday.",0.0
"**\[Alaren Stronsburg\]** is speaking with \[Feron Luxworth\] ""-So after he threw a right hook I ducked and then I grabbed the old man's shirt and threw him to the ground!""",0.0
Couldn’t eat or sleep.,1.0
I've slowly lost my family.,1.0
"Well, what happened at trial was that while they had good circumstantial evidence (Casey hid the death, acted happy, then lied about it), most of the scientific evidence was very very shaky.",0.0
I’m done with living.,1.0
Hey guys no one is wishing me on my bday.can you guys make it special?,1.0
I just don't know how to fix me.,0.0
"Though one owner replied back and said that it was a vaguely familiar story, but since over 30 years had passed since that time they no longer remembered any of the details.",0.0
Nemta suddenly wondered if maybe he would have been better off as a POW of the Terrans.,0.0
I really don’t wanna die i just want a happy fucking life.,1.0
"This, we remember.”
 
 
“*We remember*,” the crowd answered, as Diggs struggled to find the words, trying to follow the others.",0.0
"He said he liked it but he still couldn’t be with me anymore, but he likes me and wants to still be apart of my life and vice versa.",1.0
I'm so so tired and I hate this feeling.,1.0
My partner is killing me with his attitude towards substances.,0.0
"Depressed not because of my childhood friend ( well yes but that's not the true cause of my inner pain), but another female friend who basically gave a introverted boy a new life.",1.0
What do I do?,0.0
“I’m only a manhunter *sometimes*.,0.0
"Hate that I didn't finish video until today, but later is better than never.",0.0
"And we see on the footage the person doesn't make a lot of effort to pry open a locked door - surely a thief is there to obtain valuables and would want to look inside a locked room more than one left unlocked, and if they are there to steal things where is the bag to put the items in to?",0.0
"I have great support, amazing friends and all the opportunity in the world.",0.0
She loved me more than anyone and I took her for granted and thought she would always be there no matter how bad I got.,0.0
" 

My breath quickens as I approach my destiny.",1.0
"""Fucking asshole..."" groaned Stidwell as he slowly managed to get to his feet, stunned.",0.0
Did the humans design it like this on purpose?,0.0
That a simple thing as a cigarette saved somebody’s life.,0.0
Today is the first day in 6 months that I cleaned my room because I fell into a big depression and I was tired all day and I couldn't find the motivation to clean my room or take care of my hygiene.,0.0
The neighbor still has to go to work and wakes up at 6h30.,0.0
"I once had a friend tell me ""I can't hang out with just you.",1.0
"I will be happy if I am completely wrong but if there is a 1% chance I'm right, WE, have a problem wouldn't you say Major?""",0.0
I feel tingly and twitchy and angry.,1.0
"I guess anything can happen in that amount of time, but I hope it hasn’t - a lot of people would be much worse off if this number stopped ringing.",0.0
Momma wouldn’t have to take care of a failure she calls « her little girl ».,0.0
"I cry and the tiniest things (and I'm not a cryer) and can't focus anymore, I feel restless and unfulfilled all the time and  like I'm 15 again and I'm sliding back into those really bad feeling and emotions and I just don't know what to do or how to manage it.",0.0
"If he doesn’t love me then I’m not really sure why I’m here, because that means that nearly everything good in my life, except my son, was a lie.",0.0
Ig.,0.0
"**And now I'm trapped in my house for the next two or three months:**

* Being nearly totally lone
* Addicted to porn, video games, and television to dull my sadness.",1.0
Someone wishes they could have some aspect of your character.,0.0
"i have shared my darkest moments with them, and the fact that i dont see them anymore puts me in a state of loneliness.",1.0
"“Because I said so, idiot.",0.0
"A smirk and snort from the half elf, ""I have the precarious task of roping in the dwarves of the Hidar Mountains.""",0.0
It was a silly idea.,0.0
But my epic mom tells me that I can skip school.,0.0
When I got home my dad made me talk to him about what has been going on and eventually I broke down crying.,1.0
I wish there was a way for me to signal to the world: just Leave Me the Fuck Alone please.,1.0
i loved him and now everything has gone away.,1.0
She’s scared I’ll hurt her again.,0.0
"Eventually I started petting her and calmed down a little, thanking her over and over.",0.0
"However no close relation to Crabb could identify the body, including former lovers.",0.0
"I told one of my friends how I've been feeling and showed her my scars but all she said was ""oh of course you're telling me NOW.""",0.0
I get massively bullied no one will ever love me cause I'm a fucking mess i wish it all could just stop and the weight would lift off my shoulders i need a friends i don't think i will make it i cant go on like this i feel trapped inside my own mind and it all just needs to stop just for a moment please it hurts.,1.0
Both me and my boyfriend suffer mental illnesses.,1.0
"I should’ve never said anything.....😕
Thanks for listening to my short rant",1.0
"I'd save up, some how, I'd work extra time on Lyft and get to her and we'd figure it out.",0.0
So i try by making my face how it feels it would be while sad but if i want to i can make a straight face and i don’t understand why... i go numb if i do this though.,1.0
But I know that something will make me get up again.,0.0
From self loathing to drowning myself in weed.,1.0
"I get home, I try to skateboard and I can’t enjoy it.",1.0
We met almost everyday since he worked at the restaurant and I went there to eat.,0.0
Crying every night before I go to bed.,1.0
“It gonna be while.,0.0
Anyone else feel like no one actually likes you and people just tolerate you.,1.0
And it feels empty.,1.0
I've had this realisation for a while now.,0.0
Jared liked playing his PS3 and going to the movies.,0.0
There was only the silence of space as the rest was consumed.,0.0
I could simply hear him smiling on the phone.,0.0
"Someone else will always own the land I walk on, the water i drink, and the air I breathe so why tf should I stick around for this?",1.0
I don’t know why I got super depressed but it hit me suddenly after the semester.,1.0
Humans are warm blooded mammals.,0.0
I feel so trapped in my job and my depression is just spiraling more and more and more.,1.0
It's hard to deal with this shit.,1.0
I f****** hate her I f****** hate what she did to me.,1.0
I got into a really bad accident which started it all off.,0.0
I've gotten rejected every time.,1.0
"The killer, however, could be another migrant worker who brought his Vietnamese wife to the big city, but again, this seemed unlikely, guys who ""buy"" wives would try to isolate the wife lest she runs off.",0.0
Thanks.,0.0
You're too young to be stressing about anything.,0.0
Can anyone relate and if so please help.....please.,1.0
I do what I can even trying to schedule my time but I feel like it’s not enough of what I end up doing.,0.0
And frankly everything costs money or is illegal so what is even the point.,0.0
I know she doesn’t trust me.,1.0
I live in CT,0.0
Now I am stuck.,0.0
"my reasoning behind this was that when you’re 22 you can drink and smoke (which i thought would help, stupid.)",1.0
I hate going out alone because I feel embarrassed but I still do so which is rarely.,1.0
\-perhaps her body was in a state of decomposition that made it heavier and more dense than the common suicides that happen at the falls commonly.,0.0
"It was unfamiliar to him so he attempted to take it off for closer inspection, but he found that it was stuck.",0.0
"- Trying to find a reason to get motivated to do something productive, when you don't care about any of the rewards.",0.0
I’ve never done anything like this before.,0.0
or 'Doom' is a big honour seemingly.,0.0
The daily hurt and not wanting or having the energy to leave your bed.,1.0
Can’t sleep.,1.0
Is there any way to recover this or any legal route to go down to recover this money.,0.0
From danger.,0.0
"""No.",0.0
She was the sweetest person I’ve ever met.,0.0
The mind is a battlefield between words and visions where our screams are silenced by cuts on our wrists and we bleed out our pain through ink on burned notebooks.,0.0
It feels like everything sits still.,1.0
It was on my fourth birthday where my life started to tread downhill.,1.0
Nemta asked.,0.0
"I did them over and over and each time I attempted it took me roughly 15 minutes until ,again, I knew it was the wrong answer.",0.0
"No, probably not, not without knowing more.",0.0
I need to distract my mind but everything seems like too much effort.,1.0
"A handful of peole know about my hospitalization and whenever I try to open it about how I'm feeling currently, they ask me why don't I go to the hospital.",0.0
I feel like I want to do it.,0.0
I sit in my schools library.,0.0
And thinking about people feels like memories.,1.0
I am constantly walking around the class talking to my friends.,0.0
No one was there.,0.0
At the time we were dating for 7 months.,0.0
"I hate myself and anyone who tells me that I’m pretty, funny, a nice friend ect.",1.0
I have tons of friends.,0.0
Are ye kiddin’ lass?,0.0
"I suffer from paranoia, anxiety, the aforementioned topic of this post, and a few other things that I cannot find a label for, that do not fall under the label of the others.",1.0
"I don’t know who to turn to anymore, to just sit down with someone and get everything off my chest.",1.0
"“We are in my temple, you unbearable mate of mine!”

“OUT!” The Sun Priest seethed as Ratha drew her knife and waved it at the screen.",0.0
"Constant headaches and receiving treatment on my brain, because of an unfortunate incident that occurred three years ago, which lead me to my second brain hemorrhage.",0.0
Thanks for letting share my feelings.,0.0
I wish I could just be normal.,0.0
"Now I have this reminder that I used to have someone that I could be completely open and vulnerable with and now it feels like I would just be a burden on everyone, so it’s better if I just secluded myself.",1.0
"That's not a bad thing entirely, I still have a lot to do, and I'm on bided time.",0.0
The company several times indicated to me that the tenant wasn’t supportive of completing the lease and I kept telling them that I wanted it finished or to terminate the contract.,0.0
Looking at all this I feel that I shouldn't have any reason to be unmotivated/unfulfilled in my life.,0.0
"My best friends are mexican, and plenty kids in the class have disabilities.",0.0
Someone please help me.,1.0
Asgar nodded.,0.0
The thought of him being deceased while I was home and me not knowing was terrifying.,1.0
It feels like the world doesn’t exist outside.,1.0
😞,0.0
Today has been a really good day.,0.0
I go to bed not knowing what the emotion wheel will land on in the morning.,1.0
I do not want to be there again.,1.0
"I don't know how to explain this but I'm at a road block and I don't know what to in general, I stay up late every night, overthinking and just overall really miserable.",1.0
"They struck me when I had no spear in my possession, and as such, I found myself defenseless.",0.0
"""What?""",0.0
You're getting into the mindset already.,0.0
"I moved away from home last year, away from everything and everyone I knew, other than my family who moved with me.",1.0
The shadows were deepening.,0.0
I haven’t talked to my dad in over a year.,1.0
I stayed sitted in the backyard the whole night.,1.0
I feel like I’m in a bubble.,1.0
Does anyone else feel like they could disappear tomorrow and no one would really care?,0.0
"My dad also became very verbally abusive when my mom ran away when I was around 12, and it has really affected my opinion on men, along with the guys who insisted they were into me, but easily got swept up by sexual desire when it came to my ex-best friend if she offered herself.",1.0
I have friends and family who love me but all I can think is I'm a waste of space.,0.0
i feel like i am fucking useless.,1.0
"His eyes closed for what felt like years and when they opened again, he was sent into a frenzy.",0.0
And wanting to tell them it's okay to lose time.,0.0
"But, I couldn't answer anything.",0.0
I’m just so sick of constantly feeling like my sadness is a burden on the people around me.,1.0
"They enact it with a sort of viciousness and pride that seemingly only ever results in violence and death, with enemies laid low and no mercy shown.",0.0
"I’m so sick of trying to change things, only to end up at the same place: where everything is hopeless.",1.0
But I also have trust issues.,0.0
"On the 31st of January, the day of the Super Bowl match, David’s wife and daughter returned home from Dallas.",0.0
He likes someone else who said some mean stuff to me.,1.0
My mom was a caring person who didn't want people we knew to be homeless and such so we let people stay for little sums of money or helping with things around the house.,0.0
I attempted suicide (a long time ago; I'm fine now in that respect) during an episode like this once.,1.0
I’ve got nobody to talk to and my only outlet is cutting myself.,1.0
I have no outstanding traits about me.,1.0
"in the end... on a day i wen't to gift her some cookies (she loves cookies) i meet her on the way to her home, we chat just a bit... she seemed happy, but it kills me see her and the eyes and not see that bright like before.",1.0
Embelshing the white blotted paper with visicious colour.,0.0
"""It really was 'Both'?",0.0
Being the beacon of positively when I want nothing more than to just break down.,1.0
"My childhood, 3 family dogs that helped me emotionally, my birth mom, my birth siblings.",0.0
"He figured, by the time he rounds on 2 more patients, she might be better acclimated.",0.0
"Now, listen here, Eldest Archangel!",0.0
Why can't I just be happy?,0.0
I’ve been emotionally numb since the beginning.,1.0
I am 19 y.o.,0.0
"""She killed herself in her bathroom......there were no windows in her bathroom and none of the windows in her apartment  are broken either.",0.0
I drank 8 antidepressants now i dont know how to sleep or work or function.,1.0
Even the elven defenders took a moment to realize what was happening and then an earth-shattering boom as some thousand cannons fired.,0.0
"“Hicks!” Johnson said as he reached the corporal, “Take your squad and hit the aliens from behind.",0.0
"And the Two Clouds!""",0.0
I know that I have to do a lot of work on myself to get to the place I wanna be but I am just not feeling it.,1.0
"Outside the windows, red hot fire had replaced the pure black of space, but even that was fading now, slowly making way for the dull, faded browns of Cienalori's upper atmosphere.",0.0
"&#x200B;

Does anyone else regret they're younger days?",1.0
"Be careful!”

Onward and downward.",0.0
"From the way my brain works, from the way I process things, from the way I sound, from the way I look, from the way I act.",0.0
i've come to the point that i have relied on them for happiness and clung to them to a point that i am empty without them.,1.0
"""Before the Evil Ones came, I would have scoffed at such words,"" Mother said.",0.0
"&#x200B;

“Sir, I’d suggest it’s been barren for at least five centuries although I can’t be more specific than that.",0.0
"Although the prosecutor has chosen not to file charges, I consider the circumstances of the death of this beautiful little boy to be an unresolved mystery.",0.0
Wait.,0.0
"My emotions feel faked, except when it's anger and sadness.",0.0
"I keep them suppressed with the booze, the pills.",1.0
"""What do you hold on to, to stop you?""",1.0
the last few days i feel like i am sinking and the world is going to swallow me and that my body is just disintegrating in a vat of acid.,1.0
i don’t want to sound like one of those pretentious kids who think they were born in the wrong generation but i really do.,1.0
"**AND I WILL CUT YOU DOWN...**

For as long as it was capable, the Precursor fired wildly, purplish bolts glancing off the thing's head, accomplishing almost nothing.",0.0
"well I want to see how this thing thinks, see if it can do even basic problem solving and the like so I threw a puzzle at it disguised as a way to keep from getting bored.",0.0
"One foot, being my left, is now ahead of the rest of my body.",0.0
Claim whats rightfully yours.,0.0
i wanna hug myself.,0.0
I even planned on living in the dorms and getting a part time job as I took my classes at the college.,0.0
To become a small part of the greatest force for good that existed in the cosmos.,0.0
"I was busy and had no time to think at all about anything other than what I was doing, and when I finally had a moment, my whole day came crashing.",1.0
"I just wanted to give y'all some tips
-stay away from depression related stuff, music/movies/books anything
-get people who make you miserable out of your life
-*live in the moment* Don't think about the past.",0.0
Nothing ever changed.,1.0
I hate knowing I took her virginity.,0.0
It was a glimmer of hope in what has been the dark black hole abyss that is my life.,1.0
"I am gaining a lot of toxic relationships too, I realized that people I began to surround myself around are all rude and cruel.",0.0
"I don't see any point in trying my best, yet I just do the minimum to not disappoint others.",1.0
